{
  "id": "hook-furnace-saboteur",
  "campaignId": "project-3",
  "placeId": "place-sunspike-glassworks",
  "headline": "Furnace Saboteur",
  "description": "Someone inside the works is ruining shipments on a schedule, not a grudge.",
  "status": "available",
  "priority": "medium",
  "checks": [
    {
      "id": "check-furnace-heat",
      "label": "Work the heat line",
      "attribute": "Fortitude",
      "dc": 16,
      "rollMode": "manual"
    }
  ],
  "threadIds": ["thread-furnace-blackmail"],
  "notes": "Alternate future path if the vault thread widens out instead of deepening.",
  "updatedAt": "2026-04-06T09:30:00.000Z"
}
