{
  "id": "hook-sable-auctioneer",
  "campaignId": "project-3",
  "placeId": "place-gilt-hall",
  "headline": "Sable Auctioneer",
  "description": "The auctioneer knows who paid for silence but will not say it cheaply.",
  "status": "discarded",
  "priority": "low",
  "checks": [
    {
      "id": "check-auctioneer-bluff",
      "label": "Pressure the auctioneer",
      "attribute": "Deception",
      "dc": 17,
      "rollMode": "manual"
    }
  ],
  "threadIds": ["thread-auction-mask-network"],
  "notes": "This line is cold unless the table loops back.",
  "updatedAt": "2026-04-06T09:30:00.000Z"
}
