{
  "id": "hook-meet-manager",
  "campaignId": "campaign-mornqar",
  "placeId": "place-gold-bank",
  "headline": "Meet the Bank Manager",
  "description": "A social hook where the manager may reveal vault routines.",
  "status": "available",
  "priority": "high",
  "readAloudSections": [
    {
      "id": "manager-intro",
      "header": "Meeting the Manager",
      "trigger": "When the players gain a private audience",
      "text": "The manager smiles too quickly and keeps glancing at the vault corridor.",
      "completed": false
    }
  ],
  "checks": [
    {
      "id": "insight-check",
      "label": "Read the manager's nerves",
      "attribute": "Insight",
      "dc": 14,
      "rollMode": "d20_button",
      "result": null,
      "notes": ""
    }
  ],
  "threadIds": [
    "thread-silent-bell"
  ],
  "notes": "Can branch into bribe, bluff, or blackmail.",
  "updatedAt": "2026-04-06T12:00:00Z"
}